"card_id","key_infor","vietnamese_meaning","english_meaning","english_meaning_separated_by_space","english_ipa","english_ipa_separated_by_space"
"1","love, dream, awesome","Mọi người thích mơ mộng vì những giấc mơ thật tuyệt vời. (Ghép từ hai câu bị ngắt bởi dấu ba chấm.)","People love to dream because dreams are **awesome**.","People___love___to___dream___because___dreams___are___**awesome**.","/ˈpipəl lʌv tə drim bɪˈkɔz drimz ər ˈɔsəm/","ˈpipəl___lʌv___tə___drim___bɪˈkɔz___drimz___ər___ˈɔsəm"
"2","dream, night, day","Chúng ta mơ vào ban đêm và chúng ta mơ vào ban ngày.","We dream **at night** and we dream **during the day**.","We___dream___**at___night**___and___we___dream___**during___the___day**.","/wi drim æt naɪt ənd wi drim ˈdʊrɪŋ ðə deɪ/","wi___drim___æt___naɪt___ənd___wi___drim___ˈdʊrɪŋ___ðə___deɪ"
"3","when we're young, dream about, wanna be, we're older, when","Khi còn trẻ, chúng ta mơ về việc mình muốn trở thành gì khi lớn tuổi hơn.","When **we're young**, we dream about what we wanna be when **we're older**.","When___**we're___young**,___we___dream___about___what___we___wanna___be___when___**we're___older**.","/wɛn wɪr jʌŋ wi drim əˈbaʊt wʌt wi ˈwʌnə bi wɛn wɪr ˈoʊldər/","wɛn___wɪr___jʌŋ___wi___drim___əˈbaʊt___wʌt___wi___ˈwʌnə___bi___wɛn___wɪr___ˈoʊldər"
"4","grow older, dream about, young again","Và khi chúng ta già đi, chúng ta lại mơ về việc được trẻ lại.","And when we **grow older**, we dream about being **young again**.","And___when___we___**grow___older**,___we___dream___about___being___**young___again**.","/ænd wɛn wi ɡroʊ ˈoʊldər wi drim əˈbaʊt ˈbiɪŋ jʌŋ əˈɡɛn/","ænd___wɛn___wi___ɡroʊ___ˈoʊldər___wi___drim___əˈbaʊt___ˈbiɪŋ___jʌŋ___əˈɡɛn"
"5","in dreams, can fly, if you can't, run into, someone who can","Trong những giấc mơ, bạn có thể bay, và nếu bạn không thể, bạn sẽ va vào ai đó có thể bay được. (Ghép từ hai câu bị ngắt bởi dấu ba chấm.)","In dreams, you **can fly**, and if you can't, you'll probably **run into** someone who can.","In___dreams,___you___**can___fly**,___and___if___you___can't,___you'll___probably___**run___into**___someone___who___can.","/ɪn drimz ju kən flaɪ ənd ɪf ju kænt jul ˈprɑbəbli rʌn ˈɪntu ˈsʌmwʌn hu kæn/","ɪn___drimz___ju___kən___flaɪ___ənd___ɪf___ju___kænt___jul___ˈprɑbəbli___rʌn___ˈɪntu___ˈsʌmwʌn___hu___kæn"
"6","go anywhere, distant land, overrun by dinosaurs, sound like, good friend Carl","Trong những giấc mơ, bạn có thể đi đến bất cứ đâu, như một vùng đất xa xôi đầy khủng long có giọng nói giống người bạn tốt của bạn, Carl. Ồ chào, có gì mới không? (Ghép từ hai câu bị ngắt bởi dấu ba chấm, và câu chào ngắn của Carl được ghép vào câu liền trước.)","In dreams, you can go anywhere, like a distant land **overrun by dinosaurs** who **sound like** your good friend Carl. Oh hey, what's up?","In___dreams,___you___can___go___anywhere,___like___a___distant___land___**overrun___by___dinosaurs**___who___**sound___like**___your___good___friend___Carl.___Oh___hey,___what's___up?","/ɪn drimz ju kən ɡoʊ ˈɛniwɛr laɪk ə ˈdɪstənt lænd ˌoʊvərˈrʌn baɪ ˈdaɪnəsɔrz hu saʊnd laɪk jʊr ɡʊd frɛnd kɑrl oʊ heɪ wʌts ʌp/","ɪn___drimz___ju___kən___ɡoʊ___ˈɛniwɛr___laɪk___ə___ˈdɪstənt___lænd___ˌoʊvərˈrʌn___baɪ___ˈdaɪnəsɔrz___hu___saʊnd___laɪk___jʊr___ɡʊd___frɛnd___kɑrl___oʊ___heɪ___wʌts___ʌp"
"7","even if, nightmares, teeth fall out, crush loves you, stuck on a bus","Và ngay cả khi những giấc mơ trở thành ác mộng, nơi tất cả răng của bạn rụng hết và bất ngờ bạn đang ở trường học, đó cũng chỉ là một giấc mơ, nơi người bạn thầm thích vẫn yêu bạn, điều đó tốt hơn nhiều so với việc bị kẹt trên xe buýt với gã này. (Ghép từ nhiều đoạn câu bị ngắt bởi dấu ba chấm.)","And even if these dreams become nightmares, where all your **teeth fall out** and suddenly you're in school, it's only a dream, where your crush loves you anyway, which is much better than being **stuck on a bus** with this guy.","And___even___if___these___dreams___become___nightmares,___where___all___your___**teeth___fall___out**___and___suddenly___you're___in___school,___it's___only___a___dream,___where___your___crush___loves___you___anyway,___which___is___much___better___than___being___**stuck___on___a___bus**___with___this___guy.","/ænd ˈivən ɪf ðiz drimz bɪˈkʌm ˈnaɪtmɛrz wɛr ɔl jʊr tiθ fɔl aʊt ænd ˈsʌdənli jʊr ɪn skul ɪts ˈoʊnli ə drim wɛr jʊr krʌʃ lʌvz ju ˈɛniweɪ wɪtʃ ɪz mʌtʃ ˈbɛtər ðən ˈbiɪŋ stʌk ɑn ə bʌs wɪð ðɪs ɡaɪ/","ænd___ˈivən___ɪf___ðiz___drimz___bɪˈkʌm___ˈnaɪtmɛrz___wɛr___ɔl___jʊr___tiθ___fɔl___aʊt___ænd___ˈsʌdənli___jʊr___ɪn___skul___ɪts___ˈoʊnli___ə___drim___wɛr___jʊr___krʌʃ___lʌvz___ju___ˈɛniweɪ___wɪtʃ___ɪz___mʌtʃ___ˈbɛtər___ðən___ˈbiɪŋ___stʌk___ɑn___ə___bʌs___wɪð___ðɪs___ɡaɪ"
"8","experience anything, in a dream, putting a phone, on your face, why wouldn't you","Vậy nên, nếu bạn có thể trải nghiệm bất cứ điều gì trong một giấc mơ, chỉ bằng cách đặt một chiếc điện thoại lên mặt bạn, tại sao bạn lại không mua chiếc điện thoại đó? (Ghép từ ba đoạn câu bị ngắt bởi dấu ba chấm.)","So, if you could **experience anything** in a dream, just by putting a phone on your face, **why wouldn't you** get that phone?","So,___if___you___could___**experience___anything**___in___a___dream,___just___by___putting___a___phone___on___your___face,___**why___wouldn't___you**___get___that___phone?","/soʊ ɪf ju kʊd ɪkˈspɪriəns ˈɛniθɪŋ ɪn ə drim dʒʌst baɪ ˈpʊtɪŋ ə foʊn ɑn jʊr feɪs waɪ ˈwʊdənt ju ɡɛt ðæt foʊn/","soʊ___ɪf___ju___kʊd___ɪkˈspɪriəns___ˈɛniθɪŋ___ɪn___ə___drim___dʒʌst___baɪ___ˈpʊtɪŋ___ə___foʊn___ɑn___jʊr___feɪs___waɪ___ˈwʊdənt___ju___ɡɛt___ðæt___foʊn"
"9","virtual reality, powered, Galaxy S7 Edge","Một chiếc Galaxy S7 Edge mới được trang bị công nghệ thực tế ảo.","A new **virtual reality** powered Galaxy S7 Edge.","A___new___**virtual___reality**___powered___Galaxy___S7___Edge.","/ə nu ˈvɜrtʃuəl riˈæləti ˈpaʊərd ˈɡæləksi ˈɛs.sɛvən ɛdʒ/","ə___nu___ˈvɜrtʃuəl___riˈæləti___ˈpaʊərd___ˈɡæləksi___ˈɛs.sɛvən___ɛdʒ"